{
  "schema": 1,
  "source_motion_sha256": "0123456789abcdef0123456789abcdef0123456789abcdef0123456789abcdef",
  "fps": 30.0,
  "selected_frames": [
    {
      "source_frame": 12,
      "time_s": 0.4,
      "root_translation_m": [0.12, 0.0, 0.06],
      "root_rotation": [1.0, 0.0, 0.0, 0.0],
      "hips_translation_m": [0.0, 0.02, 0.0],
      "local_rotations": {
        "sceneRoot": [1.0, 0.0, 0.0, 0.0],
        "hips": [1.0, 0.0, 0.0, 0.0],
        "spine": [1.0, 0.0, 0.0, 0.0],
        "chest": [1.0, 0.0, 0.0, 0.0],
        "upperChest": [1.0, 0.0, 0.0, 0.0],
        "neck": [1.0, 0.0, 0.0, 0.0],
        "head": [1.0, 0.0, 0.0, 0.0],
        "leftShoulder": [1.0, 0.0, 0.0, 0.0],
        "leftUpperArm": [0.9800665778, 0.1986693308, 0.0, 0.0],
        "leftLowerArm": [1.0, 0.0, 0.0, 0.0],
        "leftHand": [1.0, 0.0, 0.0, 0.0],
        "rightShoulder": [1.0, 0.0, 0.0, 0.0],
        "rightUpperArm": [0.9800665778, -0.1986693308, 0.0, 0.0],
        "rightLowerArm": [1.0, 0.0, 0.0, 0.0],
        "rightHand": [1.0, 0.0, 0.0, 0.0],
        "leftUpperLeg": [1.0, 0.0, 0.0, 0.0],
        "leftLowerLeg": [1.0, 0.0, 0.0, 0.0],
        "leftFoot": [1.0, 0.0, 0.0, 0.0],
        "leftToes": [1.0, 0.0, 0.0, 0.0],
        "rightUpperLeg": [1.0, 0.0, 0.0, 0.0],
        "rightLowerLeg": [1.0, 0.0, 0.0, 0.0],
        "rightFoot": [1.0, 0.0, 0.0, 0.0],
        "rightToes": [1.0, 0.0, 0.0, 0.0]
      }
    },
    {
      "source_frame": 24,
      "time_s": 0.8,
      "root_translation_m": [0.24, 0.0, 0.12],
      "root_rotation": [0.9950041653, 0.0, 0.0998334166, 0.0],
      "hips_translation_m": [0.0, 0.04, 0.0],
      "local_rotations": {
        "sceneRoot": [1.0, 0.0, 0.0, 0.0],
        "hips": [1.0, 0.0, 0.0, 0.0],
        "spine": [1.0, 0.0, 0.0, 0.0],
        "chest": [1.0, 0.0, 0.0, 0.0],
        "upperChest": [1.0, 0.0, 0.0, 0.0],
        "neck": [1.0, 0.0, 0.0, 0.0],
        "head": [0.9950041653, 0.0, 0.0998334166, 0.0],
        "leftShoulder": [1.0, 0.0, 0.0, 0.0],
        "leftUpperArm": [0.921060994, 0.3894183423, 0.0, 0.0],
        "leftLowerArm": [1.0, 0.0, 0.0, 0.0],
        "leftHand": [1.0, 0.0, 0.0, 0.0],
        "rightShoulder": [1.0, 0.0, 0.0, 0.0],
        "rightUpperArm": [0.921060994, -0.3894183423, 0.0, 0.0],
        "rightLowerArm": [1.0, 0.0, 0.0, 0.0],
        "rightHand": [1.0, 0.0, 0.0, 0.0],
        "leftUpperLeg": [1.0, 0.0, 0.0, 0.0],
        "leftLowerLeg": [1.0, 0.0, 0.0, 0.0],
        "leftFoot": [1.0, 0.0, 0.0, 0.0],
        "leftToes": [1.0, 0.0, 0.0, 0.0],
        "rightUpperLeg": [1.0, 0.0, 0.0, 0.0],
        "rightLowerLeg": [1.0, 0.0, 0.0, 0.0],
        "rightFoot": [1.0, 0.0, 0.0, 0.0],
        "rightToes": [1.0, 0.0, 0.0, 0.0]
      }
    },
    {
      "source_frame": 48,
      "time_s": 1.6,
      "root_translation_m": [0.48, 0.0, 0.24],
      "root_rotation": [0.9800665778, 0.0, 0.1986693308, 0.0],
      "hips_translation_m": [0.0, 0.08, 0.0],
      "local_rotations": {
        "sceneRoot": [1.0, 0.0, 0.0, 0.0],
        "hips": [1.0, 0.0, 0.0, 0.0],
        "spine": [1.0, 0.0, 0.0, 0.0],
        "chest": [1.0, 0.0, 0.0, 0.0],
        "upperChest": [1.0, 0.0, 0.0, 0.0],
        "neck": [1.0, 0.0, 0.0, 0.0],
        "head": [0.9800665778, 0.0, 0.1986693308, 0.0],
        "leftShoulder": [1.0, 0.0, 0.0, 0.0],
        "leftUpperArm": [0.8253356149, 0.5646424734, 0.0, 0.0],
        "leftLowerArm": [1.0, 0.0, 0.0, 0.0],
        "leftHand": [1.0, 0.0, 0.0, 0.0],
        "rightShoulder": [1.0, 0.0, 0.0, 0.0],
        "rightUpperArm": [0.8253356149, -0.5646424734, 0.0, 0.0],
        "rightLowerArm": [1.0, 0.0, 0.0, 0.0],
        "rightHand": [1.0, 0.0, 0.0, 0.0],
        "leftUpperLeg": [1.0, 0.0, 0.0, 0.0],
        "leftLowerLeg": [1.0, 0.0, 0.0, 0.0],
        "leftFoot": [1.0, 0.0, 0.0, 0.0],
        "leftToes": [1.0, 0.0, 0.0, 0.0],
        "rightUpperLeg": [1.0, 0.0, 0.0, 0.0],
        "rightLowerLeg": [1.0, 0.0, 0.0, 0.0],
        "rightFoot": [1.0, 0.0, 0.0, 0.0],
        "rightToes": [1.0, 0.0, 0.0, 0.0]
      }
    }
  ],
  "skeleton_id": "animocap_canonical_v1",
  "coordinate_contract": {
    "unit": "meter",
    "handedness": "right",
    "up_axis": "Y",
    "forward_axis": "Z",
    "source": "canonical"
  }
}
